{
  "source": "skills@1.7.4 agents table (dist/cli.mjs)",
  "scope": "user",
  "total": 3,
  "providers": [
    {
      "id": "amp",
      "name": "Amp",
      "project_dir": ".agents/skills",
      "global_dir": "~/.config/agents/skills",
      "path": "/home/fixture/.config/agents/skills",
      "universal": true,
      "managed": false,
      "synca_agent": null,
      "present": false,
      "skills": 0
    },
    {
      "id": "claude-code",
      "name": "Claude Code",
      "project_dir": ".claude/skills",
      "global_dir": "~/.claude/skills",
      "path": "/home/fixture/.claude/skills",
      "universal": false,
      "managed": true,
      "synca_agent": "claude",
      "present": true,
      "skills": 12
    },
    {
      "id": "eve",
      "name": "Eve",
      "project_dir": "agent/skills",
      "global_dir": null,
      "path": null,
      "universal": false,
      "managed": false,
      "synca_agent": null,
      "present": false,
      "skills": 0
    }
  ]
}
